{
  "$schema": "https://json-schema.org/draft/2020-12/schema",
  "description": "Rows a request may bring for the itinerary template: { table: [row] }. Generated by scripts/gen-schemas.ts; do not edit.",
  "type": "object",
  "properties": {
    "plan": {
      "type": "array",
      "items": {
        "type": "object",
        "properties": {
          "$key": {
            "type": "string",
            "minLength": 1,
            "description": "This row's name within the request, for $ref"
          },
          "day": {
            "type": "string"
          },
          "time": {
            "type": [
              "string",
              "null"
            ]
          },
          "kind": {
            "type": "string",
            "enum": [
              "flight",
              "stay",
              "food",
              "do"
            ]
          },
          "title": {
            "type": "string"
          },
          "detail": {
            "type": [
              "string",
              "null"
            ]
          }
        },
        "required": [
          "$key",
          "day",
          "kind",
          "title"
        ],
        "additionalProperties": false
      }
    },
    "bookings": {
      "type": "array",
      "items": {
        "type": "object",
        "properties": {
          "$key": {
            "type": "string",
            "minLength": 1,
            "description": "This row's name within the request, for $ref"
          },
          "what": {
            "type": "string"
          },
          "ref": {
            "type": [
              "string",
              "null"
            ]
          },
          "when": {
            "type": [
              "string",
              "null"
            ]
          },
          "status": {
            "type": "string",
            "enum": [
              "Confirmed",
              "Pending",
              "Cancelled"
            ]
          },
          "cost": {
            "anyOf": [
              {
                "type": "integer",
                "minimum": -9007199254740991,
                "maximum": 9007199254740991
              },
              {
                "type": "null"
              }
            ]
          },
          "plan_id": {
            "anyOf": [
              {
                "type": [
                  "string",
                  "null"
                ]
              },
              {
                "type": "object",
                "properties": {
                  "$ref": {
                    "type": "string",
                    "pattern": "^plan/.+"
                  }
                },
                "required": [
                  "$ref"
                ],
                "additionalProperties": false
              }
            ]
          }
        },
        "required": [
          "$key",
          "what"
        ],
        "additionalProperties": false
      }
    },
    "packing": {
      "type": "array",
      "items": {
        "type": "object",
        "properties": {
          "$key": {
            "type": "string",
            "minLength": 1,
            "description": "This row's name within the request, for $ref"
          },
          "item": {
            "type": "string"
          },
          "who": {
            "type": "string"
          },
          "packed": {
            "type": [
              "boolean",
              "null"
            ]
          }
        },
        "required": [
          "$key",
          "item"
        ],
        "additionalProperties": false
      }
    },
    "trip_budget": {
      "type": "array",
      "items": {
        "type": "object",
        "properties": {
          "$key": {
            "type": "string",
            "minLength": 1,
            "description": "This row's name within the request, for $ref"
          },
          "category": {
            "type": "string"
          },
          "spent": {
            "anyOf": [
              {
                "type": "integer",
                "minimum": -9007199254740991,
                "maximum": 9007199254740991
              },
              {
                "type": "null"
              }
            ]
          },
          "limit_amount": {
            "type": "integer",
            "minimum": -9007199254740991,
            "maximum": 9007199254740991
          }
        },
        "required": [
          "$key",
          "category",
          "limit_amount"
        ],
        "additionalProperties": false
      }
    }
  },
  "additionalProperties": false
}
